Title,Profile,Date,Rating,ProductSize,Verified_Purchase,Review
Autonomía,Amazon Customer,"September 30, 2021",5.0,Color: Phantom BlackSize: 128GBStyle: S21 Ultra,Verified Purchase,Excelente
Great phone,devinda,"September 30, 2021",5.0,Color: Phantom BlackSize: 128GBStyle: S21 Ultra,Verified Purchase,Fast shipping. Came in original box. S21 ultra 5G is a great phone.  I am very happy.
It's original,Luis,"September 23, 2021", 5.,Color: Phantom BlackSize: 128GBStyle: S21 Ultra,Verified Purchase,It's everything that i expected
Excellent,Brenda,"September 19, 2021",5.0,Color: Phantom BlackSize: 128GBStyle: S21 Ultra,Verified Purchase,I am very pleased with the product.  Fast delivery. Love it!
"If you want a phone with a great camera, this is the one you want!",R Jackson,"September 18, 2021",5.0,Color: Phantom BlackSize: 128GBStyle: S21 Ultra,Verified Purchase,The best phone I have ever purchased.
s21 ultra,Alexandra Fuentes,"September 11, 2021",5.0,Color: Phantom BlackSize: 128GBStyle: S21 Ultra,Verified Purchase,"Diseño espectacular, talvez es un poco mas grande para mi mano. Vino desbloqueado que era lo mas importante."
most likely the last samsung phone I will buy,Amazon Customer,"September 11, 2021",1.0,Color: Phantom BlackSize: 128GBStyle: S21 Ultra,Verified Purchase,".. or certainly not spend 1k+ Camera had issues just after a month or so. Support process is very cumbersome. Had issues registering the phone imei ... the service center process is another mess! Didn't have stock of the parts .. so much for a flagship product. I do understand you can get a bad unit, but would have expected a straight forward  support that they would send me a replacement unit and then I send back the one with issue."
Samsung galaxy s21 ultra,Stanley,"September 6, 2021", 5.,Color: Phantom BlackSize: 128GBStyle: S21 Ultra,Verified Purchase,Buena inversión
Best phone so far!,Carlos Jimenez,"September 6, 2021",5.0,Color: Phantom BlackSize: 128GBStyle: S21 Ultra,Verified Purchase,Phone heavy but will get used to it
Great phone!!!,MAC,"August 28, 2021",5.0,Color: Phantom BlackSize: 128GBStyle: S21 Ultra,Verified Purchase,Great quality with no complaints at all. Highly recommend this phone!!
"Can't say enough bad things about Samsung (Horrible customer service for a $1,000 piece of trash)",RPB,"August 28, 2021",1.0,Color: Phantom BlackSize: 128GBStyle: S21 Ultra,Verified Purchase,"After owning the phone for about 45 days, the screen began to flicker.  There is not a single scratch on this phone.  I wouldn't even unbox it until I got my Otterbox case for it.  I called Amazon.  Amazon was very helpful.  They told me that it was past 30 days and I could not return it but it was still under the manufacturer warranty and connected me with Samsung.  Samsung seemed like they were going to help.  They told me me since it was such a recent purchase it was still under warranty and gave me a list of local shops to bring it to be repaired, free of charge.  I brought it to the shop (UbreakIFix), the kid behind the counter rang me up for $380.00.  I told him Samsung said it would be taken care of.  The kid tried turning the screen on a few times, when it wouldn't turn on, he whacked it on the heel of his palm.  The kid pointed to a tiny black speck in the corner of the screen and said ""you have to pay because of this"".  I let him know it wasn't there before he whacked it and left the store.  I called Samsung customer care and they told me that there is absolutely nothing they can do about it.  Stick to Apple, at least they have decent in-house customer care."
So far so good,Amazon Customer,"August 27, 2021",4.0,Color: Phantom BlackSize: 128GBStyle: S21 Ultra,Verified Purchase,Pretty PETTY that they charge all this money for this phone and can't provide an adapter with it. I don't know how many people they think have type-C outlets.  The phone is an inch longer and heavier than my previous phone. Good to have a wireless charger for this phone however that can be a challenge in your car.
"Amazing camera, super fast, battery life isn't the best",Sebastian Sanchez,"August 27, 2021",5.0,Color: Phantom BlackSize: 128GBStyle: S21 Ultra,Verified Purchase,Amazing phone. Top notch camera has given me amazing pictures on my multimonth vacation (why I purchased the phone). Only downside is the battery life isn't the best due to the huge screen size. Great phone I would highly recommend.
No es bueno en algunas cosas por ejemplo si no le pongo el alta voz no se escucha,Rocio,"August 25, 2021",3.0,Color: Phantom BlackSize: 128GBStyle: S21 Ultra,Verified Purchase,Que no se escucha si no le pongo el alta voz
No es lo que esperaba,Jaime Lara,"August 23, 2021",2.0,Color: Phantom BlackSize: 128GBStyle: S21 Ultra,Verified Purchase,"Compre este teléfono, lastimosamente vino defectuoso y me toco mandar a reparar el botón power. Vengo de tener un huawei P30 pro, es decir, un teléfono con excelente cámara. Para mi sorpresa, a pesar de ser gama tope de samsung y tener la mejor cámara, tanto la interfaz como el procesamiento de imagen es inferior al huawei P30 pro con el Android 10.0. La nitidez, la reducción de ruido en tomas oscuras, la saturacion de colores, la apertura, el efecto bokeh y el modo profesional son mejores en el P30 pro. Solo la cámara de 108mp y el zoom digital x 100 son los puntos fuertes de la cámara de este teléfono. No digo que sea una mala compra, pero para ser gama tope de Samsung esperaba más. Saludos desde El Salvador"
Great phone,Lucy,"August 18, 2021",5.0,Color: Phantom BlackSize: 128GBStyle: S21 Ultra,Verified Purchase,Phone is a great phone takes great pictures but the battery don't last too long and it takes really long to charge but it's still worth it I like it
No tan impresionante,cesar adonis flores,"August 17, 2021",3.0,Color: Phantom BlackSize: 128GBStyle: S21 Ultra,Verified Purchase,"Equipo es pesado, en mi país funciona lento en páginas de internet"
The battery doesn't last long.,Horlorlardey,"August 14, 2021",5.0,Color: Phantom BlackSize: 128GBStyle: S21 Ultra,Verified Purchase,The battery doesn't last long.
Great Purchase,Xoxo,"August 14, 2021", 4.,Color: Phantom BlackSize: 128GBStyle: S21 Ultra,Verified Purchase,Great battery life and camera quality
Expensive but nice,David,"August 14, 2021",4.0,Color: Phantom BlackSize: 128GBStyle: S21 Ultra,Verified Purchase,The C port loses connection from time to time. Very frustrating for the money.
Amazing,MBlack,"August 11, 2021",5.0,Color: Phantom BlackSize: 128GBStyle: S21 Ultra,Verified Purchase,Boyfriend loved it. Might get one for me.
Nothing like a digital SLR...not worth it,Cassandra Englund,"August 11, 2021",3.0,Color: Phantom BlackSize: 128GBStyle: S21 Ultra,Verified Purchase,"I've had a digital SLR camera, and this phone supposedly took great photos with remarkable quality so I decided to buy this rather than a new SLR. I have been really disappointed with this phone's camera features. Wish I would have bought a new SLR and kept my old phone."
Great phone. Ok battery. Awsome camera.,Lar,"August 11, 2021",5.0,Color: Phantom BlackSize: 128GBStyle: S21 Ultra,Verified Purchase,Great phone. Ok battery. Awesome camera. Spent all day in a truck during a heatwave though and took quite a while to cool down enough to not be hot to the touch. With prima day sales it was a steal of a deal compared to any of the local deals. It was quite the upgrade from tge s7 active i have had the past few years.
Zoom - good. Photo quality - sucks (worse than older models),Amazon Customer,"August 11, 2021",2.0,,,"It's nice that it has zoom lenses, but everything else about th camera seems worse. Whatever post editing Samsung is doing, sucks. Color have too much saturation and all details are lost if something has a vibrant color (such as iguanas here in Florida). In general, there's a lot of noise and blochiness in the pictures.  Not impressed. I, like so many others, find the pictures on older models to be more detailed and accurate.Also, why on earth would you get rid of sd card slots and headphone jacks. That was the primary advantage you had over apple. The moment apple has a phone with a decent zoom lenses, goodbye Samsung."
Solid phone,Lucas,"August 9, 2021",5.0,Color: Phantom BlackSize: 128GBStyle: S21 Ultra,Verified Purchase,Very solid phone with a great prime day deal
Don't buy,Tim Bennett,"August 9, 2021",1.0,Color: Phantom BlackSize: 128GBStyle: S21 Ultra,Verified Purchase,"Don't buy. Nice camera, decent battery. That's about it. No quality control.  Cheaply made. No memory card. No indicator light. It's just a cheap phone. I've been a Samsung fan for years but my next phone will be an Apple."
Cmon Samsung..,Joseph Pastusek,"August 8, 2021",3.0,Color: Phantom BlackSize: 128GBStyle: S21 Ultra,Verified Purchase,"For a $1200 flagship one would think the batter would be great, but frankly it's complete ass. For the specs it has, it surely doesn't operate as long as it should.Maybe I got a bad battery or the phone simply isn't tweaked to perform as it should"
Value for money!,Hussain Didi,"August 7, 2021",5.0,Color: Phantom BlackSize: 128GBStyle: S21 Ultra,Verified Purchase,Says used but the phone was brand new. Came in an open box.
Worst camera ever,Kulbir,"August 6, 2021",1.0,Color: Phantom BlackSize: 128GBStyle: S21 Ultra,Verified Purchase,"The camera feels like the photos are captured using a camera from 2016.Low light photos are even worse. 4 cameras and no camera can capture a good photo.I bought this phone because of Android. But seriously disappointed.If you compare the photos with iphone 12 pro, they stand out without doubt.Would suggest you to wait for Google pixel 6 pro.Don't buy s21 ultra. Worst camera on a flagship phone ever. Way to go Samsung. I'm sorry but your cameras are really really bad. Or your image processing algorithms are really really bad. Please improve. Thanks"
Reliable and easy to use!,Amazon Customer,"August 3, 2021",5.0,Color: Phantom BlackSize: 128GBStyle: S21 Ultra,Verified Purchase,Good quality phone without the Apple price!
Unlocked phones are bloat free. The OS seems polished and things work well.,Christopher A. Boyer,"August 1, 2021",5.0,Color: Phantom BlackSize: 128GBStyle: S21 Ultra,Verified Purchase,"Getting used to the 21 ultra from the s6 edge I find things just work better. The functionality is complete with my Truck's Bluetooth.  It reads my txt to me, something the same didn't do. It downloaded my entire phone book in one shot. S6 would choke and then the rest had to be downloaded one at a time. The screen is bigger but the edge was fine in that respect. I changed phones because t-mobile sent out letters saying the old technology was being phased out by January. I had just replaced the battery in the edge for drone use and was not looking to replace it. That said the unlocked phone is great in that it doesn't have bloatwear on it. The camera impressed me, especially on a close up of a coin to see the details. My complaint is nonreplaceable battery and no micro SD card slot. Water resistance is a joke, light rain used over and over. How about toilet depth? Seems like that would be useful. The pen seems useful and they say it will one day work the camera. Hopefully that's true."
Great phone. Lightning fast,Danny K,"July 31, 2021",5.0,Color: Phantom BlackSize: 128GBStyle: S21 Ultra,Verified Purchase,Fast. Ability to choose cell phone provide of my choice. Great camera and storage with fast processor!
A step down from the Note 20 Ultra,Donali Peter,"July 30, 2021",3.0,,,"Extremely disappointed in this phone. Without expandable storage it couldn't even receive the transfer of all that was on my Note 20 Ultra, and that was without transferring files or photos. And even though there is marginal support for an SPen, there is no on board storage for one. While a compatible blue tooth S Pen is in the works, it not yet released, which is another fail because now there is no remote function for the camera. And the camera was the main reason to get this phone, but with no expandable storage, every fabulous, HD photo/video you take steals from your internal storage which you need to run your apps, etc. I feel stupid for not thinking about these things in advance, and not realizing there was no expandable storage before I ""upgraded"". Definitely suffering from buyer's remorse. This phone has already had response issues, which I never experienced with the Note 8, Note 9 or Note 20 Ultra. Do not recommend."
Trade in,Daniel norbert luca,"July 30, 2021",1.0,Color: Phantom BlackSize: 128GBStyle: S21 Ultra,Verified Purchase,They agreed on trading in my old phone note10+ in perfect shape after I told them that I got it from Tmobile.I've sent it out and they returned it. Saying that they can not take it in a phone that is locked even though I have told them from the beginning.
Amazon did right by me,Paul Camerone,"July 29, 2021",3.0,Color: Phantom BlackSize: 128GBStyle: S21 Ultra,Verified Purchase,I've used Samsung exclusively since the S3 the ultra is an excellent phone and the camera is absolutely amazing. The phone I purchased had many issues the worst being a touchscreen that freeze's up as well as issues with the keyboard. Amazon took it back NQA looking forward to getting new one that works properly.
HEADLINE... customization,Weeza,"July 28, 2021",5.0,Color: Phantom BlackSize: 128GBStyle: S21 Ultra,Verified Purchase,"This is a beautiful phone, but the thing that has impressed me most is the customization that Samsung has built in this model. I've used Samsung in the past and always been disappointed by the amount of bloatware they included. This phone it is kept to a minimum and there are so many settings to really customize to my individual wants. I've been using pixels and I love the operating system and being able to customize more than any Apple phone but the quality of the camera and the screen is so much better on this Samsung."
Great Phone,Carole Huschle,"July 27, 2021",5.0,Color: Phantom BlackSize: 128GBStyle: S21 Ultra,Verified Purchase,Love my phone!!
Great device! I'm very pleased.,Empress Itrina,"July 27, 2021",5.0,Color: Phantom BlackSize: 128GBStyle: S21 Ultra,Verified Purchase,The phone meets and surpasses all my expectations
Best phone 📱 made to date 📅.,Michael,"July 26, 2021",5.0,Color: Phantom BlackSize: 128GBStyle: S21 Ultra,Verified Purchase,I bought this for my girlfriend. She is so very happy. Yeah it cost more then most phone's. But completely worth it. Now if I could get her off her phone long enough to go to dinner. Lol worth every dime spent. Awesome quality! Oh and Beautiful pictures. You can do just about anything with this phone. To bad it doesn't do the dishes. Lol but it does everything else.
S21 Ultra. It's Amazing,Adarsh Tandon,"July 23, 2021",5.0,Color: Phantom BlackSize: 128GBStyle: S21 Ultra,Verified Purchase,Great phone. Have been using for a month now bit it's a great durable phone and awesome camera with great build over all.  Battery is good for a day
"Have to return, battery does not hold charge",cifr,"July 22, 2021",1.0,Color: Phantom BlackSize: 128GBStyle: S21 Ultra,Verified Purchase,"Looks cool, many camera lens, but the battery does not hold a charge."
Amazing phone but buy a super fast charger,Wes Techie,"July 21, 2021",5.0,Color: Phantom BlackSize: 128GBStyle: S21 Ultra,Verified Purchase,"Moved to the 21 ultra from an unlocked S10.  The battery and camera on this device are outstanding. Added the OtterBox commuter case, AM film tempered glass screen protector and the 65 watt Anker super fast charger. It is disappointing a charger couldn't be included for such a high level device thats capable of super fast charging. Sure I have several old charging plugs laying around but none capable of putting out wattage for the super fast charge. Bought the Anker 65 watt charger and works fine just another added expense. There is not headphone jack or as card storage expansion but so far have not missed them since I have some wireless earbuds and large enough storage on the phone for what I do."
Good phone,pradeep datla,"July 20, 2021",4.0,Color: Phantom BlackSize: 128GBStyle: S21 Ultra,Verified Purchase,High quality phone with lot of software issues. Mainly bought it for photos but the quality is not on par with iphone
Beat phone I ever had,Justice Harris,"July 16, 2021",5.0,Color: Phantom BlackSize: 128GBStyle: S21 Ultra,Verified Purchase,Phone is fire
Cut through the drama,Sassy chassis,"July 15, 2021",5.0,Color: Phantom BlackSize: 128GBStyle: S21 Ultra,Verified Purchase,"I had been shopping this phone make and model for a while. My husband is a pro photographer and was reluctant to give up his precious Samsung 6 because of its superior camera, however it was outdated in the battery life department. Lets face it renting a phone and then either purchasing it or being told basically it isnt anything as a trade to the next one that you will also be renting is just another contract that ties up your options and money.  An opportunity I couldnt resist happened when the target phone came up as a lightning deal while i was Prime day shopping.  It was flawlessly activated today. No hiccups.So so happy. And we have no strings or drama about flex lease or billing.  The price point still cant be matched anywhere else. Win win"
Thought battery would last longer then 1 day of use,Grimreaper,"July 15, 2021",5.0,Color: Phantom BlackSize: 128GBStyle: S21 Ultra,Verified Purchase,"I don't use it a lot but it still takes the battery to 15% in a 24 hour period. I even slow charge it at 15w takes over 4 hours, still last just 24 hours. Love the camera, love everything about it. i came from  Pixel 2 XL so a lot of changes."
